File Name,Skills,Certifications,Tools,Additional Expertise
Anil Kunche - Java Support (1).docx,"Angular, JavaScript, Typescript, HTML5, CSS3, SASS/LESS, REST, GraphQL, Swagger, AWS ECS, AWS EKS, AWS Lambda, AWS CloudWatch, Java, Python, Spring Boot, Hibernate, MongoDB, MySQL, SQL, NoSQL, JUnit, Mockito, Jenkins, Selenium, JMeter, Splunk, PagerDuty, Git, GitHub, Bitbucket, Agile, Jira, Confluence",AWS Certified Developer Associate (valid until Jun 2024),"Angular, JavaScript, Typescript, HTML5, CSS3, REST, GraphQL, Swagger, AWS ECS, AWS EKS, AWS Lambda, AWS CloudWatch, Java, Python, Spring Boot, Hibernate, MongoDB, MySQL, SQL, NoSQL, JUnit, Mockito, Jenkins, Selenium, JMeter, Splunk, PagerDuty, Git, GitHub, Bitbucket","Experienced in building responsive landing pages, Expertise in enhancing customer experiences, Skilled in optimizing performance by 30%, Adept at leading teams in Agile environments, Experienced in collaborating with cross-functional teams to drive customer-facing web projects, Expertise in implementing multithreading and concurrency controls to enhance application responsiveness and performance, Skilled in implementing responsive strategies to enhance accessibility by 25% across devices and optimize user experiences, Expertise in engineering back-end functionalities with Node.js to improve data processing by 40% and dynamically tailor content to visitor preferences, Experienced in documenting APIs using Swagger, resulting in a 20% increase in adoption and usage, Expertise in orchestrating deployment of microservices on AWS EC2 instances via Spring Boot, delivering exceptional uptime of 99.9% with scaling capabilities, Skilled in executing CRUD operations on MongoDB, enhancing data management efficiency and slashing data retrieval time by"
Anthony David Macpherson - Java Support (1).docx,"Python 3, Git, PostgreSQL, MySQL, SQLAlchemy, AI models, Pandas, HTML, JavaScript, Jira, Confluence, Java 8/11, C++, C#, Spring Boot, Spark, Looker, GCP, Vue.js, R, Angular",None mentioned,"Jupyter Labs, Spring Boot, Visual Studio Code, Looker Extension Framework, Spark, GCP, SQLAlchemy, Confluence, Vue.js","Evaluating AI models' ability to program in various languages, Developing AI models' ability to read and process data analysis prompts, Optimizing code for generating database table feature statistics, Maintaining and developing internal Python technologies for data processing and billing automation, Documenting internal technologies and database designs, Prototyping user interfaces, Developing unit tests following Test Driven Development"
Ghouse Mohammed - AIML (2).docx,"Machine Learning, Distributed Systems, Artificial Intelligence, Big Data, Cloud Architecture, Java, Python, REST, Apache Hadoop, Apache Spark, HBase, Kafka, Deep Learning, AWS (EMR, Sagemaker, Lambda, EKS, ECR, Lex, Redshift), MLFlow, Kubeflow, ETL & Data Warehousing, Lambda & Kappa Architecture, Feature Selection & Engineering, Distributed Computing, Data Extraction & Preparation, Data Munging & Validation, Data Discovery & Cleaning, Docker, Kubernetes, Databricks, Azure, GCP, OpenAI, AGI, ChatGPT, LLMs",None mentioned,"Apache Hadoop, Apache Spark, HBase, Kafka, AWS (EMR, Sagemaker, Lambda, EKS, ECR, Lex, Redshift), MLFlow, Kubeflow, Docker, Kubernetes, Databricks, Azure, GCP, OpenAI, ChatGPT","Technical Leadership, Stakeholder Relationship Management, Consistent Operations Improvement, Automation and Optimization of Data Pipelines and Processes, Fraud Detection and Risk Management, Marketing and Pitch Development"
JAYESH LAD - Java Support (1).docx,"Programming Languages: Java, C, C++, PL/SQL, Python, Web Technologies: Servlets, J2EE, JSP, HTML, CSS, JavaScript, XML, React, Java Technologies: Spring, Spring Boot, Spring Hibernate, JDBC, Web Services: REST, XML, SOAP, Databases: PostgreSQL, SQL Server, MySQL, MongoDB, Web/App Servers: Java Web Server, Apache Tomcat, Build Tools: Jenkins, Maven, IDEs: IntelliJ, Eclipse, VSCode, SpringToolSuite, Frameworks: Spring Boot, Spring, Hibernate, Log4j, Junit, ReactJS, Testing Tools: Junit, Mockito, Selenium, Operating Systems: Windows, UNIX, Linux, Development Methodologies: Agile Methodologies, Waterfall Model, Test Driven, Version Control: Git",None mentioned,"Jenkins, Maven, IDEs: IntelliJ, Eclipse, VSCode, SpringToolSuite, Frameworks: Spring Boot, Spring, Hibernate, Log4j, Junit, ReactJS, Testing","Strong understanding of Core Java concepts including Data Structures and Algorithms, Collections, and Exception Handling, Experience in developing Automation Frameworks and Automation scripts using Selenium, Experienced in utilizing AWS services including EC2 and S3 for scalable and secure application deployment, Proficient in creating and consuming RESTful web services using Spring Boot and Spring Rest Controller, Experienced in RDBMS (SQL Server, Oracle, MySQL, PostgreSQL) and NoSQL databases (MongoDB), Well-versed in version control tools like Git for efficient code management, Experienced in developing microservices using Spring Boot, adhering to domain-driven design principles, Ensured cross-browser and cross-platform compatibility in web applications using MERN Stack and other modern technologies, Experienced in developing applications using React.js, Java8, and new features of Java (lambda expressions), Strong knowledge in MERN/MEAN stack with vast experience in building Web Applications, Extensively worked on Spring JDBC, Spring"
Joseph Barr - Java Support (2).docx,"Java, Python, Maven, Jenkins, Linux Bash / Shell script, SonarQube, Google Cloud Platform (GCP), Spring, Spring Boot, CSS, HTML, IntelliJ, Microsoft Visual Studio Code, Terraform, Docker, Kubernetes, Helm Charts, Datadog, PagerDuty, Agile / Scrum, Confluence, Jira, ServiceNow, Oracle SQL, PostgreSQL, JUnit, JSON, REST API",None mentioned,"Oracle SQL, PostgreSQL, Datadog, PagerDuty, Confluence, Jira, ServiceNow, Jenkins, SonarQube, Google Cloud Platform (GCP), Terraform, Docker, Kubernetes, Helm Charts","Root cause analysis, Data reporting and tracking, Automation and environment management, Code refactoring and improvement, Continuous Integration/Continuous Delivery (CI/CD) optimization, Technical debt reduction, Website development and hosting"
Jyothsna Naidu- Java Support (1).docx,"Programming Languages: Java, JavaScript, Back-End Development: Spring Boot, RESTful API Design, Database Migration (AWS Aurora), Asynchronous Messaging (Kafka), Front-End Development: HTML, CSS, Angular, React, Full-Stack Development: Spring Boot and Angular, Real-Time Features (WebSocket's), CI/CD Pipelines (Jenkins, GitLab), Docker Containerization, Cloud Technologies: AWS (Microservices Migration), AWS Lambda (Serverless), Amazon DynamoDB (NoSQL), Infrastructure as Code (Terraform), Database Management: SQL, NoSQL (Amazon DynamoDB), Microsoft SQL Server, MS Access, Oracle, MySQL, Cassandra, Postgres SQL, PL/SQL, MongoDB, Firebase, Redis Cache, Web Technologies: AJAX, HTML5, JavaScript, XML, CSS3, AngularJS (Typescript), Express.js, React.js, Vue.js, redux, Bootstrap, webpack, Design Tools and IDE's: Eclipse, Net-beans, IntelliJ, STS4, Visual Studio Code, Testing Tools: Jasmine, Selenium, Karma, JUnit, Mockito",None mentioned,"Jasmine, Selenium, Karma, JUnit, Mockito, Certifications: None mentioned","Expertise in OOAD architecture and modeling, Extensive experience in implementing single page applications using Angular.JS directives and routing modules, Proficient in managing AWS services through AWS Console and API Integration, Extensive use of Java 8 Streams, Lambda Functions, Predicates,"
Michael Alcala - Java Support (1).docx,"Programming Languages: C#, C++, Python, Java, JavaScript, SQL, Developer Tools: Unreal Engine 5, Unity3D, Shader Graphs, Perforce, OpenGL, PySpark, Kivy, Power Apps, Visual Studios, SharePoint, Nintex, Office Dynamics 365, Technologies/Frameworks: AR, VR, 3D Math, Windows, GitHub, Hadoop, Chat GPT (Hugging Face)","Salesforce Sales Operations Specialist, Generative AI Professional, Database and SQL Professional, Certified Python Programmer, Unity Associate Training","Unreal Engine 5, Unity3D, Shader Graphs, Perforce, OpenGL, PySpark, Kivy, Power Apps, Visual Studios, SharePoint, Nintex, Office Dynamics 365, Technologies/Frameworks: AR, VR, 3D Math, Windows, GitHub, Hadoop, Chat GPT (Hugging Face), Certifications:, Salesforce Sales Operations Specialist, Generative AI Professional, Database and SQL Professional, Certified Python Programmer, Unity Associate Training","Tutoring and mentoring students in Java and Python, Improving and maintaining a multiplayer racing game with 750K users, Developing and integrating a Unity and SQL database system for a company, Developing and optimizing shaders and graphics in VR games, Constructing enemy AI blueprints and C++ code in Unreal Engine 5, Updating game-play controls in Unreal Engine 5, Producing an Android web scraper app for Fortnite using Kivy MD and Python, Developing the basics of an artificial neural network in 3 languages, including Python, Constructing a static ray tracer using OpenGL, Designing a 4-stage asset management system using Power Apps and Python, Building an application to manage and govern evidence of compliance with GRC controls for a large US bank using SharePoint and Python, Creating AI generative programs for internal research products using Python's Hugging Face and other APIs"
Munikrishnaiah Sundararamaiah - ic4 (1).docx,"Data Architecture, Design Patterns & Solutions, Data Modeling, ETL/ELT, Big Data Technologies, Cloud Computing, Metadata Management, Finance, Healthcare, Data Warehousing, Business Intelligence, RDBMS (Snowflake, Netezza, Oracle 11, DB2, MySQL, Redshift, Postgres), Cloud (Azure, AWS), Big Data (Databricks, Apache Spark, Spark SQL, Hadoop, ADF, Azure Synapse, Azure Fabric), Programming (UNIX/Linux Shell Scripting, Python, Scala, Java, Kafka, Debezium), Operating Systems (Windows NT/2000 Server, HP-UX 11.1, IBM-AIX), ETL (DataStage, Informatica), Scheduling Tools (Control-M, Autosys, Airflow)","Microsoft Fabric Analytics Engineer, Databricks Certified Data Engineer, SnowPro Core, Safe Agile Practitioner, Unix AIX, Google Generative AI Fundamentals","Snowflake, Databricks, Apache Spark, Spark SQL, Hadoop, Azure Synapse, Azure Fabric, Azure Data Factory, AWS Glue, AWS SQS, AWS Lambda, AWS SNS, AWS EMR, Informatica, DataStage, Tableau, Python, Scala, Java, Kafka, Debezium, Control-M, Autosys, Airflow","Anomaly detection using machine learning models, Historical timestamping and Slowly Changing Dimensions (SCD Type-1, SCD Type-2, SCD Type-4), Data pipeline architecture design, Enterprise data processing workflow orchestration, Data quality, completeness, and redundancy tracking, Data security, backup, disaster recovery, and archiving strategies, Business requirement gathering and data solution design, Team management and leadership"
Sree R. Pinnamaneni - ic4 (1).docx,"Data engineering, Data management, Data warehouse systems, Distributed computing, Big data technologies (Hadoop, Hive), Cloud computing (Snowflake, Databricks, Redshift, AWS), Programming languages (SQL, Python, PySpark), Data engineering tools (DBT, Informatica, Glue, EMR), Data quality and governance, Platform assessment and migration, Performance tuning, Data modeling (3NF, dimensional/star)","Snowflake SnowPro Advanced: Architect Certification, AWS Solutions Architect Associate, DCAM (Data Management Capabilities Assessment Model) Certified by EDM Council, Cloudera Certified Hadoop & Spark Developer, Teradata Certified Master","Snowflake, Databricks, Redshift, Teradata, Netezza, Hadoop/Hive, AWS services (S3, Glue, EMR, Lambda, Step Functions, DynamoDB, etc.), DBT, Informatica, Syncsort DMX, Hive, Sqoop, Autosys, BTEQ, TPT","Experienced in data migration and modernization projects, Expertise in developing data management strategies and roadmaps, Proficient in data pipeline design and implementation, Experience in data masking, tokenization, and access control, Skilled in developing cloud-native applications using serverless technologies, Expertise in data quality framework and audit components, Experience in DR planning and testing for data platforms"
