File Name,Skills,Certifications,Tools,Additional Expertise
Resume_861," - Word, Excel, Outlook, PowerPoint - Adobe - ProDoc - Quickbooks - E2 System - Accounts Payable - ACT! - Administrative skills - Advertising - Analytical skills - Scheduling appointments - Attention to detail - Budget - Coaching - Conferences - Consulting - CPR - Credit - Clientele - Client - Clients - Database - Documentation - Expense Reports - Filing - First Aid - Legal documents - Director - Marketing - Meetings - Multi-tasking - Pathogen - Quickbooks - Research - Safety - Sales - Scheduling - Statistics - Telephone - Trainer - Travel arrangements - Arrange travel - Written"," - Certified Fitness Trainer (August 2012) - AHA First Aid, CPR, AED Training Certification - Oxygen Usage & Safety Awareness Training Certification - Bloodbourne Pathogen OSHA Standard 29 CFR 1910.1030(g)(2)(i) Training Certification - Excel Continuing Education - PowerPoint Continuing Education - ACT! Database - ProDoc E-Filing Webinar", - Word - Excel - Outlook - PowerPoint - Adobe - ProDoc - Quickbooks - E2 System - ACT! - ProDoc, - Counseling (Masters of Education) - Psychology & English (Bachelor of Science) - English Language (Associate of Arts)
Resume_1366," - Staffing, payroll, menu planning, inventory/ordering, P&L management - Employee training and discipline - Cleaning and equipment maintenance - Food cost control and budget management - Hiring and training staff - Overseeing dietetic techs and working with dietitians - Cash handling and statistical reporting - Purchasing and supplier management - Customer service in an open kitchen format - Staffing scheduling and demand forecasting - Implementing and supporting company initiatives - Kitchen management and food production for events - Inventory control and receiving - Food safety and temperature monitoring - Collaborative team building - Recipe development and menu engineering - Quality control and workflow management - Revenue and productivity enhancement strategies - Food preparation, tasting, and presentation - Sanitation practices and inspections - Liquor regulations and bar operations - Catering and event planning - Pricing and financial analysis - Vendor promotions and marketing", - National Registry of Food Safety Professionals Certified Food Safety Manager - National Registry of Food Safety Professionals Test Administrator/Proctor, - Food service equipment and kitchen appliances - Inventory management and ordering systems - Point-of-sale (POS) systems - Financial and accounting software - Scheduling and workforce management tools, - Specialized diet menu planning and recipe development - Nutrition and dietary standards enforcement - Liquor service and bar management - Banquet and event coordination - Vendor relationship management and procurement - Financial reporting and cost control - Regulatory compliance and inspections - Customer service and guest relations
Resume_324," - A+, Active Directory, Adobe, Apache, Backup Exec, budget, business process, C, CCNA, Cisco IOS, Cisco, Citrix, Hardware, CRM, Client, Databases, DHCP, disaster recovery, DNS, ERP, firewalls, firewall, ftp, help desk support, help desk, HP, HP servers, IIS, Information Systems, Intel, IP, IT project management, laptops, Linux, Mac OS, Macola, MAS 90, McAfee, Medical Manager, Access, MCP, Microsoft Dynamics, Excel, Exchange Server, Microsoft Exchange Server, SharePoint, Windows 7, Windows 8, 2000, Windows XP, Word, migration, MySQL, Enterprise, NAS, Network Engineering, network hardware, network security, Network, Operating Systems, PACS, PBX, PDF, phone system, phone systems, printers, programming, project management, QuickBooks, routers, Sage, SAN, scanners, Servers, SMS, software troubleshooting, SolidWorks, SQL, Supervising, switches, Cisco switches, Symantec, system analysis and design, teaching, user support, phones, terminal server, Toshiba, Trend, upgrades, VPN, VoIP, Windows 2000 Server"," - CompTIA A+, Network+, Microsoft MCP (70-210 and 70-215), previously certified as Cisco CCNA"," - Symantec Backup Exec, System Recovery, Endpoint Protection, Trend Micro, McAfee, ESET, Acronis, ShadowProtect, GFI, Crow Canyon, DameWare, Wireshark, NetFlow Analyzer, Splunk, SMS, Fluke OptiView, Solarwinds NPM, Microsoft Response Point, GP, CRM and SharePoint - SQL, MySQL - Servers, workstations, laptops, printers, smart phones, routers, switches, firewalls, wireless access points, LTO autoloaders, CCTV, PBX and IP phone systems, biometric scanners and readers - Apache, IIS, Cisco ASDM, Cisco VPN Client, MAS 90, Sage Medical Manager, BrainTree PACS/C-Arm, VMware, Citrix, SmartFilter, Imail, Websense, iPrism Web Security, Hyper-V, SonicWall Global VPN Client, Adobe, Foxit Phantom PDF, JobBOSS, Made2Manage ERP, Word, Excel, Access"," - Project management, system analysis and design, business process flow - Database maintenance - System checks and troubleshooting - Advanced troubleshooting - Virus and spyware removal - Computer diagnostics and repair - Server management - Hardware support and troubleshooting - Advanced knowledge of diagnostic techniques - Advanced knowledge of security, firewalls and DLP"
Resume_237," - account management - cables - cabling - Help Desk - Linux - MS Exchange server - Sharepoint - network security - desktop support - Unix - HP Unix - VBscript - Visual Basic Programming - Windows Server - Active Directory account management - MS Exchange server 2010 - network/server security - Geographic Information system - group policy SCOM & SCCM - vbscripts and Powershell - SANs - Hyper V - Proofpoint Spam filter - iBoss web filter - System Center Operations manager - EMC Networker backup - Lync 2013 - Skype for Business - Track It work orders - Escape Financial System - Aeries student information system - Alertus Desktop alerting - Laserfiche - Sharepoint 2013 - Informacast Speaker System - ArcGIS desktop and server - Maas360 mobile phone management - Azure - TCP/IP utilities (ping, tracert, ipconfig) - Whats up network device connectivity monitoring - Blackberry Enterprise server - Fedora Core Linux - Multi Router Traffic Grapher - Windows 2003 domain controllers - Renaissance Learning and Read 180 servers - Xiotech SAN - TNT network security appliance - Dos and VBScript scripting - Group policy - Ghost software", - Exchange: week long course - EMC Networker: week long course - ArcGIS: week long course - Windows 2012 - Powershell: week long course," - Hyper V - SANs (Nimble, Dell Equallogic, StorSimple) - Alertus desktop alerting system - Powershell - VBScript - Vsphere - HP network switches - Whats up network device connectivity monitoring software - Blackberry Enterprise server - Fedora Core Linux - Multi Router Traffic Grapher - Windows 2003 domain controllers - Renaissance Learning and Read 180 servers - Xiotech SAN - TNT network security appliance - Ghost software - Microsoft Office - Skype for Business - Track It work orders - Escape Financial System - Aeries student information system - Laserfiche - Sharepoint 2013 - Lync 2013 - iBOSS web filter - Proofpoint Spam filter - Exchange 2010 DAG and Client Access Array - Informacast Speaker System - Microsoft System Center and Operations Manager - EMC Networker backup software - ArcGIS desktop and server - Maas360 mobile phone management - Azure"," - Installed and maintained over 100 servers - Installed and maintained a Hyper V cluster of 9 nodes - Managed Active Directory user accounts and troubleshot Active Directory replication issues - Assisted with selecting and recommending Alertus desktop alerting system - Worked with users on high-level technical issues to analyze and take corrective action - Performed new employee technology orientations and cellphone training - Installed and configured HP network switches, programmed switch ports and assigned VLANs - Connected network wall ports and terminated network cables - Troubleshot network port communication errors - Installed and maintained Whats up network device connectivity monitoring software - Installed and maintained Blackberry Enterprise server for MS Exchange server - Wrote DOS and VBScript scripts to automate functions like student user account creation - Utilized group policy to secure workstations or install new software - Implemented the district Geographic Information system by recommending and working with ArcGIS - Communicated with teachers, managers and students - Installed and supported a variety of software including antivirus, Office, Fortress desktop security, Rosetta Stone, Escape financial system and other education software - Used Ghost software to image computers"
Resume_408, - Charting and recordkeeping - Child abuse prevention - Understands developmental disorders - Active listener - First aid certificate - Basic clerical knowledge - Reliable and punctual - Friendly - Cheerful and energetic - Teamwork oriented - Housekeeping, - First aid certificate, - Computers (used for record-keeping), - Enthusiastic people person - Problem-solving - Organizational skills
Resume_1662," - Administrative - Assistant Manager - Clarify - Drafting legal documents - English - Forms - Grant proposals - Human resources - Inventory - Law - Research & write briefs, opinions, & laws - Litigation - Management - Mediation - Conduct meetings - Merchandising - Office - Operations - Policies - Real estate - Receiving - Sales - Settlements - Utilities"," - Over 100 hours mediation training, American Mediation Association - Annual requirement of 12 hours Continuing Legal Education since 1984"," - Legal research and writing - Depositions and discovery - Preparing legal documents (wills, deeds, mortgages, leases, agreements) - Probate and estate planning - Negotiating settlements"," - Expertise in contracts, divorce mediation, elder care, employment, estates, family law, probate, property law, trusts, and wills - Awarded $100,000 from Gund and Cleveland Foundations to initiate Cuyahoga County Juvenile Court's Custody Mediation Program - Published articles on mediation and the ethical use of paralegals"
Resume_1175," - Multiple Facility Management and Oversight - ASC Administrator Mentoring, Training and Development - Revenue Cycle Management - Vendor Negotiations - Budget Creation and Analysis - Diverse Market and Industry Knowledge - Process improvement, QAPI Program Support - Accreditation Preparation - Payer Contracting Negotiations", - None explicitly mentioned," - Billing systems - Charting systems - Human Resource manuals - OSHA manuals - Mini OR for IVF egg retrievals - Accounting system - IT policies and procedures - MRI, CT and Ultrasound equipment - Billing software - Computer hardware"," - Helped clients establish new practices - Provided management to physician offices - Provided consultation services on various aspects of running a medical practice - Mentored Materials Manager and other ASC Administrators - Negotiated contracts with health plans, subcontracted providers, and Independent Physician Associations (IPAs) - Implemented incentive programs to increase staff productivity - Handled profit and loss responsibility - Assisted with mergers and acquisitions - Obtained JCAHO and ACR accreditations - Served as Ombudsman for the US Navy and assisted Navy families - Trained as a first responder with the American Red Cross"
Resume_915, - Excellent classroom management - Experience working with special needs students - Effectively work with parents - Motivating students - Innovative lesson planning - Positive atmosphere promotion - Advise students on academic and vocational curricula and on career issues, - Subject Matter Authorization in Science: Science (2016) - Crosscultural Language and Academic Development Certificate (2005), - Diploma program development for Adult Education - Lesson planning and introduction of new learning methods," - Material development, including creating college prep lessons and developing new courses - Plan development for balanced programs of instruction, demonstration, and work time - Goal setting and clear communication of objectives and expectations - Parent communication and student-centered curriculum planning"
Resume_530, - adaptive equipment - administrative duties - appointment setting - agency - blood pressure - CNA - consultant - CPR (Certified) - first aid - Home Care - team building - meal prep - Medical terminology - medication management - meetings - bathing - policies - quality - record keeping - recording - scheduling - supply inventory - teaching - phones - therapy - vision - wounds - written communication, - CPR (Certified) - Certified CNA/HHA & Medical Assistant, - Computerized applications for scheduling and various administrative duties - Hyperbaric chamber and other hyperbaric support systems, - Critical thinker - Understands medical procedures - Effectively influences others - Good written communication - Relationship and team building - Medical terminology knowledge - Cultural awareness and sensitivity - Maintains strict confidentiality
Resume_2007," - Construction Estimating / Management - Procore Project Management - Primavera Project Scheduling P2 - Microsoft Word, Microsoft Excel, Microsoft Project - Field Operations / Inspections - Troubleshooting/ Problem Solver - Quality Control / Inspection - Team Building / Leadership - Project Coordination / Development - OSHA Regulation / Project Safety - Cost / Profit Analysis - Civil Engineering - Project Planning and Development - Project supervision", - OSHA -62 Hour Site Safety Supervisor - 30 – Hour OSHA Construction Safety & Health Certificate - 8 Hour Site Safety Manager Refresher/ Chapter 33 Certificate - 8 Hour - NYC DOB SST: Fall Prevention Training - 4 HR -NY DOB SST- Supported Scaffold User and Refresher Training - 8 HR- OSHA Prescribed SST Courses Bundle - 4 HR- OSHA SST Elective Certified Soil Inspector - Working on NYCDOB superintendent licensee, - Procore - Primavera Project Scheduling P2 - Microsoft Word - Microsoft Excel - Microsoft Project," - Extensive experience as a General Construction Project Manager - Directed and organized multi-million dollar construction projects and renovations - Optimized operations and profits for full-scale projects - Oversaw multi-trade construction teams - Proficient in project management, estimating, planning, data/profit analysis, resourcing, organizational networking, professional development, fieldwork supervision, and leadership - Experienced in a variety of construction environments including power plants, government, healthcare, housing, and educational settings - Skilled in troubleshooting field issues and design conflicts - Adept at building and maintaining productive relationships with construction teams and third parties - Mentors and leads by example as a team player"
Resume_2190," .Net, Agile, Apple, approach, ask, banking, basic, benefits, book, Browsers, content, credit, clients, Databases, database, debit, documentation, XML, fast, Finance, financial, Functional, funds, GUI, HP, Internet Explorer, Inventory, Inventory Management, Apple Mac, meetings, Mercury Interactive, MS Excel, Microsoft Office, Windows 7, Windows, WIN 7, 2000, Windows 95, 98, NT, Windows XP, Operating Systems, OS, Oracle, PCI, POS, Quality, quality assurance, QA, Requirement, retail, scrum, SDLC, scripts, Specification, SQL, SQL Server, Test Director, upgrades, Vendor Management",None mentioned," Quality Center, JIRA, Oracle, SQL Server 2005/2008, Internet Explorer, Firefox, Chrome, Safari, Mercury Interactive Tools (HP): Test Director, Quality Center, ALM, Apple-IOS, Android, Windows"," - 4+ years of experience as a Quality Assurance Analyst - Experience with various levels of testing such as Functional, Regression, System, User Acceptance, Performance, and Smoke testing - Experience testing applications based on different architectural platforms (Client/Server, Web-based, SAAS) - Industry experience in Finance, Banking, Retail, and Healthcare - Well-versed in Agile, Agile Scrum, Waterfall, and V-Model methodologies - Experience communicating with stakeholders and dealing with different teams (offshore and onsite) - Experienced in creating Test Plans, Test Scenarios, and executing Test Cases - Knowledgeable in Software Development Life Cycle (SDLC), Software Testing Life Cycle (STLC), and Defect Management Life Cycle (DMLC) - Experience in backend database testing using SQL queries - Developed and maintained quality control metrics - Strong analytical, communication, organizational, and planning skills - Ability to handle multiple tasks in a dynamic environment - Proficient in English, Hindi, and Urdu"
Resume_1054,"communication skills, Creative problem solver, MS Windows, Quick learner, sales, phone",None mentioned,publisher,"Volunteer work involving public contact, public speaking, and extensive record keeping"
Resume_2071," - MS Office Suite: Word, Excel, Access, PowerPoint, Project Pro - Cision - Google Analytics - Lexis Nexis - Fashion - Branding - Budgets - Content creation - Client management - Direction - Editorial - Email - Event planning - Special events - Financial - Functional - GPS - Image - Leadership - Marketing - Marketing communications - Media plans - Media relations - Merchandising - Press - Press releases - PR - Project plans - Public Relations - Public speaking - Retail - Sales - Speeches - Strategy - Strategic - TV - Video",None mentioned," - Cision - Google Analytics - Lexis Nexis - MS Office Suite: Word, Excel, Access, PowerPoint, Project Pro"," - Native fluency in Spanish - Experienced in managing PR agency teams - Managed large PR and social media budgets (up to $1.5M annually) - Successful in driving brand awareness and sales through PR campaigns - Skilled in developing and executing communications plans, media relations, event planning, and social media strategies"
Resume_2274, - Customer Service - Management - Inventory Management - Communication, - OSHA 40 Hour HAZWOPER Certification, - ArcGIS Program - Water Quality Testing - Stream Assessment - Tree Inventory, - Environmental Technology and Management - Phase III Environmental Site Assessment
Resume_2470," - Fiber Optics Repair Technical Skill Set - Formal Training: Learjet 24, Piper Cherokee, AeroCommander 520, and Cessna 310 Airframe and Powerplant systems - Inspections, troubleshooting, and airworthiness determinations made on aircraft utilizing technical publications, FAR's, manufacturer maintenance manuals, part catalogs and schematics - Inspection, repair, installation and troubleshooting on turbine, turboshaft, reciprocating engines, and systems therein including: Induction, Exhaust, Fuel, Ignition, Electrical, Communication/Navigation, Ice and Rain, Instruments and APU - Maintenance and inspections on Hydraulic/Pneumatic systems, Electrical, Fire protection, Flight controls, and Interiors - Fabrication of airfoils (sheet metal and composite) from blue print drawings - Registration marking and painting of aircraft surfaces - Project Management - Managerial skills - Time management - Public speaking - Organizational Skills - MS Office"," - Master Certificate in Six Sigma from Villanova University - Certified Lean Six Sigma Black Belt from Villanova University - Airframe and Powerplant Mechanics license issued by the FAA - FCC Elements 1, 3, & 8 - FCC GROL or General Radiotelephone Operator license with ship radar endorsement - FCC Commercial Operators License (Marine Radio Operator Permit)"," - Technical publications, FAR's, manufacturer maintenance manuals, part catalogs and schematics - Test benches and equipment - Schematics and diagrams - Electronic test equipment", - Troubleshooting and repairing solid state devices - Inspecting and maintaining electronic test equipment - Monitoring and safeguarding classified material and Embassy personnel - Diffusing hostile situations and investigating security and safety violations - Writing detailed incident reports
Resume_807," - Teamwork - Leadership - Ocean Safety Knowledge - Customer Service/Hospitality - Basic Japanese Speaking (greetings & customs) - Knowledge of Characteristics associated with Pricing Diamonds, Rare Gemstones, Sunrise shells - Tactics and Techniques for Executive Protection and Transportation of High Value Items - Scheduling business meetings, coordinating travel arrangements - Assisting with daily operations and monitoring employee production - Maintenance management for tour buses - Ensuring compliance with transportation regulations - Overseeing tour drivers and their clearances - Coordinating tour routes and schedules - Sales of special brand men's aloha shirts - Cashier and inventory management - Modeling men's aloha t-shirts - Safe and effective personal training - Payroll management - Conducting training groups - Selling club memberships and personal training - Opening and closing store - Training new employees on operations and policies - Reservation management and ground demonstrations - Water safety techniques and CPR - Providing basic first aid - Tactical helicopter aircrewman - Door gunner (M240D, .50 Cal Gau 16) - Anti-submarine warfare systems (acoustic/non-acoustic) - Airborne radar operator/sensor operator", - CPR qualification - Naval Aviation Systems Warfare Pin - Expert Pistol Marksmanship Medal - Expert Rifle Marksmanship Medal - Enlisted Aviation Warfare Pin, - TWIC (Transportation Worker Identification Credential) - CDL (Commercial Driver's License), - Tactical Operator of the Quarter - Scored highest on Search and Rescue Physical Evaluation and academic portion - Featured in FUTURES Magazine and on Today's Military.com - Diving with a Navy Search-and-Rescue Swimmer
Resume_254," - Issue escalation - Reporting and analysis - Quality control - Schematic understanding - Critical thinking - Data management - Network Administration - Experience in leadership - Improvement plan knowledge - Supervision - Hardware repair - Computer configurations - System upgrades - New program installations - Organizational leadership - Troubleshooting and Maintenance - Equipment repair - Power and hand tool use - Troubleshooting and repairs - Preventative maintenance - Telecommunications systems - Component repairs - Multitasking - Part inspections - Friendly, positive attitude - LAN and WAN configurations - Server and System Administration - End-User Training - Program installations - Software testing - Server improvements - Data backups - Project management - Security technologies - Network configuration - Time management - Active Directory knowledge - Cybersecurity analysis - System Administration - Microsoft Office - MS Office - Apple iOS Technician - Help desk assistance - Application software testing - Mechanical abilities - Information Systems Security Professional - Advanced knowledge of Windows OS - Advanced knowledge of Google Chrome OS - Soldering - Database management - Technical knowledge of server system softwares - Servers, storage systems, network equipment, PCs or notebooks of any brands", - F.A.A Aircraft Dispatcher License - Cybersecurity Policy For Aviation And Internet - Google IT Support Certificate, - Servers - Storage systems - Network equipment - PCs - Notebooks - Windows OS - Mac OS - Chrome OS - Linux - VMware," - Quality assurance testing with 5 years of experience - Experienced operations analyst with skills in organizing, problem solving, and project management - Passionate and driven professional with analytical and problem-solving skills - Collaborative style with well-developed communication skills - Blend of technical aptitude and creative ability - Resourceful in restoring system functionality"
Resume_1578, - Hyperion Planning - Essbase - SAP R/3 - Oracle 11 - SAP BPC - Business Objects - Sharepoint - MS Office,None mentioned, - Hyperion Planning - Essbase - SAP R/3 - Oracle 11 - SAP BPC - Business Objects - Sharepoint, - Financial planning and analysis - Financial modeling - Process improvement - Strategic planning and goal setting - Budgeting and forecasting - Variance analysis - Headcount and cost management - Dashboard and reporting development - Systems implementation and coordination - Collaborative leadership and team management
Resume_889," - Vast knowledge of strains and their effects - Trimming experience - Professional, friendly and clean - Careful and active listener - Cash handling and POS system knowledge - Microsoft Word literate - Customer service oriented", - Medical Marijuana Recommendation (Valid), - POS system - Microsoft Word, - Trimming experience
