File Name,Skills,Certifications,Tools,Additional Expertise
Resume_903," - Computer skills, including Microsoft Office - Strong verbal skills - Strong writing skills - Ability to work under pressure and limited time frame", - Certified Nursing Assistant, - Microsoft Office - Computer skills, - Academic planning - Goal setting and implementation - Counseling - Group instruction - Public speaking - Attention to detail - Dependability - Volunteer experience in various organizations
Resume_1269," - Communication skills - Adaptability - Common software application knowledge - Demonstrated organizational/planning skills - Ability to improvise - Good performance under difficult situations - Team work experience - Reliable - Weather Forecast: SmartMET work station, Statistical Analysis Software, Numerical models analysis, Observational Data Analysis, Satellite and Radar workstation"," - Diplomat Course ""Evaluation of Ecological and Climatic Risks and Environmental Impact"" from University of Alicante, Spain - INSTEC, Cuba (190h, 09/2006-05/2007) - Earned First place, General Meteorology Commission in the Students Scientific Forum, Winner of ""Benito Viñes S. J"" Prize granted by the Cuban Meteorological Society, for students category, 2007", - SmartMET work station - Statistical Analysis Software - Numerical models analysis - Observational Data Analysis - Satellite and Radar workstation," - Severe Local Storms research - Weather forecast evaluation - Developed effective working relations with groups, individuals, agencies and the public - Supervised technical and professional staff - Guaranteed data quality control standards - Trained new personnel and interns - Maintained a high rate of accuracy (over 85%) in daily forecast evaluation - Published multiple articles and papers in Cuban Meteorological Magazine and Proceedings of Cuban Meteorology Congresses - Represented Cuban Weather Service in workshops and training courses in the United States and China - Attended postgraduate courses and conferences as a speaker"
Resume_610, - Seasoned Leadership - Experienced Manager - Motivated - Balanced - Excellent written and verbal communicator - Customer service-oriented - Training and development - Event/experiential marketing - Strategic marketing planning - Budget management - Compliance and policy management - Data analysis and reporting - Retail sales and merchandising,None mentioned, - Nielsen and industry sales data analysis - Print media planning - Event marketing execution and measurement - Compliance and safety program management - Promotional material management, - Transitioning in-house event marketing to external agency model - Developing consumer engagement programs for music festivals and concerts - Implementing brand consistency and efficiency in promotional execution - Measuring promotional impact and brand affinity - Compliance and policy management for event marketing programs - Long-term strategic planning and category growth initiatives
Resume_1961, - Sales - Proposals - Solutions - Commercial Buildings - Million - Sales And - Contracts - Ecms - Energy Conservation - Energy Solutions - Industrial Facilities - Retail - Retail Marketing - Retrofit - Technical Assistance - Instrumentation - Long-term Disability - Ltd - Engineer - Hvac - Collection - Maintenance - Marketing - Networking - Project Engineer - Project Planning - Real Time - Scada - Testing - Estimating - Estimation - Estimator - Operations - Pricing - Sales Team - Takeoffs - Fire Protection - Front End - Quotations - Relationship Building - Sales Activities - Sales Engineer - Security - Siemens - Award - Clients - Csr - Energy Management - Project Development - Roi - Selling Of - Sql, - Energy Management Professional Certified by Schneider University, - Studio 360 - DCS - PLC - SCADA - Windows - MS SQL," - Energy engineering - Building energy systems - Renewable energy - Energy management of residential, commercial, healthcare, data center and industrial facilities - Performance contracting - HVAC design - Project development and implementation - Energy auditing and assessment - Energy conservation measures (ECMs) - Measurement and verification"
Resume_2168, - Administrative support - Automation - Automotive - Banking - Budgets - Interpersonal skills - Oral communication - Hardware - Customer Service - Customer Care - Databases - Direction - Documentation - Email - Financial - Forecasting - Laboratory procedures - Team lead - Team Leader - Lighting - Lotus Notes - Managing - Microsoft Access - Microsoft Excel - Microsoft PowerPoint - Microsoft Windows XP - Microsoft Word - Negotiation - Organizational skills - PC skills - Policies - Processes - Quality - Reporting - Research - Sales - SAP - Scheduling - Staffing - Tax preparation - Tax preparer - Taxes - Teamwork - Phone - Time management - Trainer - Websites - Workbench - Written communication, - Certified trainer on income tax preparation through H&R Block, - Scheduling software - Lotus Notes - SAP - Microsoft Access - Microsoft Excel - Microsoft PowerPoint - Microsoft Word - Windows XP - Workbench," - Knowledge of commercial loan pricing, credit policies, procedures, practices, and documentation - Ability to think analytically and creatively in response to problems - Ability and willingness to train and present complex concepts to audiences of varying sophistication"
Resume_1128," - Benchmarking - Big Data - Business research - Competitor Analysis - Consulting - Client management - Critical thinking - Databases (Gartner, Forrester, Datamonitor, OneSource, Factiva) - Designing - Financial analysis - Investment Banking - Investment management - Market analysis - Marketing plan - Market research - MS Excel - MS PowerPoint - MS Word - Oil and Gas - Promotion - Quality - Researching - Retail - Sales - Securities - SPSS - Strategy - Surveys - Treasury - Wealth management",None mentioned," - SPSS software - MS Word, Excel, and PowerPoint - Databases (Gartner, Forrester, Datamonitor, OneSource, Factiva)"," - Analytical and results-oriented professional - Excellent analytical skills and strong sense of structure and logic - Ability to prepare high-quality presentations and spreadsheet models - Passionate about providing high-quality, cutting-edge research - Understanding of consumer profiles and how businesses can tap into their habits, aspirations, and attitudes - Hands-on experience in market analysis, organizational structure analysis, competitive benchmarking, financial analysis, and best practice studies - Demonstrated ability to work effectively independently and in a team - Confident and concise communicator with excellent relationship and team management skills - Flexible and detail-oriented attitude"
Resume_1087, - Relationship selling - Quick learner - Resolution-oriented - Reliable and dependable - Cheerful and energetic - Dedicated team player - Hard work ethic - Strong communication skills - Creative problem solver - Strong client relations - Self-motivated - Strong verbal communication - Conflict resolution - Client assessment and analysis - Extremely organized - Team leadership - Exceptional communication skills,None mentioned, - Retail sales - Customer service - Swim instruction - Waiter/server duties - Cash handling - Inventory management - Customer relations," - Extensive experience in fast-paced, team-based environments - Over 10 years of experience leading swim and water polo teams - Expertise in personal communications and cultivating human relationships - Proficient at time management while juggling academic and athletic commitments - Elected captain of collegiate sports teams (water polo and swim)"
Resume_507, - Peer counseling - Customer service - Database - Documentation - Internet Applications - Excel - E-mail - Office - Outlook - Power Point - Publisher - Microsoft Word - Personnel - Policies - Presentations - Safety - Transportation,None mentioned, - RPMS (Resource and Patient Management System) - SAMS (State System)," - Providing services to culturally sensitive issues - Absorbing new concepts easily and adapting to highly demanding situations - Strong interpersonal and teamwork skills - Dependability in performing work and willingness to accept responsibilities - Strong written and verbal communication skills - Maintaining effective and productive working relationships - Facilitating Empowerment through Art classes for survivors - Facilitating Healthy Relationship classes/Parenting classes - Increasing office organization by developing more efficient database - Coordinating office assistant functions for a team of 3 employees - Volunteering for the Sexual Assault Response Team (SART) to provide support to victims in crisis, document vital information, and make appropriate referrals"
Resume_1041, - Teamwork - Problem Solving Skills - Strong Work Values - Leadership Skills - Dependability - Customer service oriented - Upselling - Opening and closing procedures - Creative - Communication Skills - Credit - Marketing - Window - Sales - Telephone, None mentioned, - Credit cards - Vouchers - Automatic debits - Cash register - Phones, - Peer coaching for new sales associates - Visual marketing and window display styling - Responding to safety and loss prevention incidents - Organizing in-store promotional events
Resume_1266, - Microsoft Outlook - Microsoft Word - Windows 10 - Excel - PowerPoint - Multi-line phone system - Troubleshooting - Communication - Problem-solving - Writing skills - English proficiency - Time management - Customer service - Selling - Supervisory - Training employees - Research - Protocols - Policies,None mentioned, - Microsoft Windows (Vista or above) - MAC operating system - Installing applications - Troubleshooting software issues, - Property Management - Tax Credit - Marketing - Collections - Leasing - Rental sales - Escalations management - Floor supervision - Aggressive sales-driven environment - Profit and bonuses - Counseling - Articulation - Avid interest in social media
Resume_1467," - Category Management - Data Analytics - Document Management - P&L Management - Employee Communication - Market Analysis - Product Launch - Cross-Functional Team Leadership - Project Management - Marketing Support - Product Management - Website Management - SharePoint - BPC and SAP - Microsoft Suite (Word, Excel, PowerPoint, Access, Project) - Microsoft Dynamics - Social Media Marketing - Facebook for Business - Project Management - Profitability Simulation - Nielsen Syndicated Data Analysis - Power Presentations - Technical Writing"," - Six Sigma Green Belt Training - American Management Association courses (Communicating Up, Down and Across the Organization; Critical Thinking; Fundamental Sales Techniques, Project Management Success, The Power of Persuasion)"," - Microsoft Suite (Word, Excel, PowerPoint, Access, Project) - Microsoft Dynamics - Nielsen Syndicated Data - Mintel data"," - 20 years of demonstrated experience in project management, marketing communications, sales support, strategy, research, and product development - Multi-faceted background includes food manufacturing, consumer packaged goods (CPG), furniture manufacturing, and construction industry - Effective problem-solver with expertise in managing multiple projects that require both creative and analytical skill sets"
Resume_1834, - Accounting - Balance - Budget - Business analyst - Call Center - Cash Management - Closing - Contracts - Critical Thinking - Client - Clients - Databases - Database - Documentation - Financial - Financial statements - Leadership - Team Lead - Marketing - Excel - Mail - MS Office Suites - Payroll - Policies - Processes - Progress - Quality Assurance - QuickBooks - Relationship management - Reporting - Research - Risk Management - SAP - Securities - Statistics - Supervisor - Phone - Written, - Accounting Certificate - Performing Payroll in QuickBooks 2009 Certificate, - Microsoft Office - QuickBooks - SAP - Databases, - Financial statement analysis - General ledger accounting - Risk management expertise - Portfolio management - Complex problem solving - Strong communication skills - Expert in customer relations
Resume_1211," - MVS Sysplex Environment - TSO - ISPF - JCL - JES2 - SDSF - IMS - DB2 - Ops/MVS - REXX - Thruput Manager - Workload Manager - Automate - SYSVIEW - Omegamon - Remedy - Omegaview - CICS - Strobe - RMF - SMS - Unix - Java Scripts - Java Scripting - Windows 9x/NT - Microsoft Office Suite (Outlook, Word, Excel, OneNote, Powerpoint, and Project) - SUN - Solaris - SNMP - IBM/AIX - Tivoli - TSM - CA-1 - CA-7 - Autosys - ESP - CA-DE - Control-M - Control-EM - Zeke - Zebb - Zack - Jobtrac - Scheduler - Candle Monitor Workstation - Robot Scheduler - Netview - XPTR - TCP/IP - IBM Rxx & Zxx Processors - SUN Processor - IBM RS/6000 - STK Automated Tape Silos - Hitachi 7700 - EMC DASD - AS/400 - OS/390 - VSM", - Actively pursuing PMP and Scrum Master certifications, - CA Workload Automation - Remedy - Omegaview - Strobe - RMF - SMS - Tivoli - TSM - CA-1 - CA-7 - Autosys - ESP - CA-DE - Control-M - Control-EM - Zeke - Zebb - Zack - Jobtrac - Scheduler - Candle Monitor Workstation - Robot Scheduler - Netview," - Application Development - Mainframe - Batch processing and scheduling - Change Management - Incident ticketing - Networking - Monitoring and availability of IT systems - Business Resumption planning - Database management (DB2, IMS) - Project management - Customer service - Mentoring and leading teams - Solving business problems using IT"
Resume_1316, - Programmatic advertising - Ad serving - DSP (Demand-Side Platform) - SSP (Supply-Side Platform) - DMP (Data Management Platform) - Ad Exchange - Ad Network - Campaign management - Advertising application management - Campaign analysis - Reporting tools - SQL - JavaScript - HTML5/CSS, - DoubleClick DFP-Certified - DoubleClick Campaign Manager (DCM) & DoubleClick Bid Manager (DBM)," - DoubleClick - DSPs - SSPs - DMPs - Ad Exchanges - Ad Networks - AdJuggler (ad serving management software) - Vindico, MediaMind, Pointroll, EyeWonder, Brightcove (rich media and video platforms) - RoboForm Pro, RoboForm2Go, Goodsync (customer support software)", - Strategic planning - Performance optimization - Inventory forecasting - A/B testing - Search Engine Marketing (PPC) - Display Advertising - Social Media - Mobile Advertising - Website solutions - Digital marketing tools - Tracking pixel implementation - Technical documentation and training - UI/UX design - Customer support and client onboarding
Resume_867, - Account reconciliation - Exceptional organization - Billing and collections expert - Invoice and payment transactions - Account management - Administrative - Balance sheets - Benefits - Call Center - Cash management - Closing - Contracts - Credit - Clientele - Clients - Customer satisfaction - Excellent customer service - Customer Service - Customer support - Databases - E-mail - Senior management - Fashion - Fast - Fax - Inventory - Leadership skills - Ledger - Managing - Marketing strategies - Marketing - Office - Window - Payroll - Performance reviews - Policies - Pricing - Process improvement - Processes - Quality - Quality assurance - Selling - Sales - Scheduling - Seminars - Staffing - Telephone - Phone - Upgrading,None mentioned, - Customer service management systems and databases - Call Center management systems," - Mastery of customer service management systems and databases - Excelled in meeting objectives through use of independent action, prioritization, persistence, and leadership skills - Defused volatile customer situations calmly and courteously - Managed customer calls effectively and efficiently in a complex, fast-paced and challenging call center environment - Resolved service, pricing and technical problems for customers - Prepared reports and communication for senior management and clients - Managed high call volume with tact and professionalism - Initiated operations improvements to improve overall call center productivity - Provided incentive to increase productivity by offering employees awards for best customer service - Oversaw call center employees to ensure customer satisfaction goals were consistently met - Conducted performance reviews for all Customer Service Representatives to reduce resolution time and improve customer satisfaction rates - Acted professionally and patiently when addressing negative customer feedback - Improved call center functionality and service capacity by resolving customer complaints efficiently and quickly - Developed all process controls and metrics for daily management of the Call Center - Greeted customers, described products, and assisted customers in person and via telephone - Communicated with vendors regarding back order availability, future inventory and special orders - Successfully acquired new customers and generated revenue growth - Provided an elevated customer experience to generate a loyal clientele - Implemented marketing strategies which resulted in customer base growth - Recommended, selected and helped locate and obtain out-of-stock product based on customer requests - Answered product questions with up-to-date knowledge of sales and store promotions - Effectively communicated with and supported sales, marketing and administrative teams - Conducted weekly walk-throughs with the manager to discuss interior visual displays - Ensured superior customer experience by addressing concerns, demonstrating empathy and resolving problems - Managed wide variety of customer service and administrative tasks - Recipient of multiple positive reviews acknowledging dedication to excellent customer service - Monitored cash drawers in multiple checkout stations to ensure adequate cash supply"
Resume_1090, - Microsoft Office proficiency - Time management - Meticulous attention to detail - Professional and mature - Strong problem solver - Resourceful - Dedicated team player - Strong interpersonal skills - Understands grammar - Academic - Air Force - Attorney - Back-up - Case Management - Cashier - Clerical - Closing - Cooking - Customer Relations - Customer Service - Faxes - Organize files - Filing - Financial - Forms - Inventory - Marketing - Merchandising - Access - Microsoft Excel - Excel - Money - Office - Word - Office equipment - Copy machine - Police - Problem Solving - Quick - Reading - Read - Reception - Maintain records - Retail Sales - Scheduling - Tables - Phones - Phone - Time management - Type,None mentioned," - Case Management System (CMS) - Genesis - Judicial Access - CLETS (Rap Sheets, DMV, FBI) - Microsoft Excel - Microsoft Word - Standard office equipment (copy machine)"," - Skilled in running CLETS (Rap Sheets, DMV, FBI, etc.) and understanding the results - Knowledge in ordering suspension packets/DMV records and DUI priors - Ability to multi-task and solve problems quickly - Handling cash and check transactions - Typing felony and misdemeanor complaint forms - Volunteering experience with a Special Education Assistance Program"
Resume_2064," - Public relations - Media relations - Crisis management and communications - Integrated marketing campaigns - Written communications (press releases, media alerts, pitch letters, articles) - Editing - Feature and speech writing - Message development - Newsletter creation - Interview coordination - Internal and external communications planning - Website copy and maintenance - Marketing collateral development - Social media - Quantitative and qualitative research - Leadership and management - Mentoring - New business development (RFPs, client presentations) - Microsoft Office (Word, Excel, PowerPoint, Outlook)", - Graduate Certificate in Public Relations and Journalism," - Content management systems (CMS) - Adobe Creative Suite (for advertising, branding, layout)"," - Expertise in various industries including food, retail, tourism, technology, science, biotechnology, healthcare, non-profit, and government - Proven track record of securing media placements in top publications and outlets - Experienced spokesperson and crisis management strategist - Volunteer leadership and community involvement"
Resume_2483, - Architectural Drafting - AutoCAD - Clerical - Customer Service - Data Entry - Dispatching - Drivers - Film - Forklift - Forklift Operator - Forms - Instruction - Inventory - Mechanical - Mechanic - Excel - Microsoft Office - PowerPoint - Windows - Word - Navy - Naval - Packaging - PeopleSoft - PeopleSoft 9.0 - Personnel - Presentations - Procurement - Purchasing - Quality Control - Receiving - Reconciling - Research - Safety - Scanning - Shipping - Spreadsheets - Supervisor - Trainer - Word Processing - Word Perfect," - Certified Trainer Forklift Truck Operator Safety - AutoCAD Certificate in Architectural Drafting - Llewellyn Technology Certificate, Electro Mechanical Systems Repair", - PeopleSoft - Infrared Scanning System (IFR) - Four-stage electronic single person picker - Signode banding and tie wrapping machines - Synergy - Minipac-poly shrink film packaging systems, - Procurement and Purchasing (over 10 years of experience) - Inventory management and control - Spreadsheet development for reporting and cost savings - Forklift operation and safety training - Aircraft hydraulic and structural systems maintenance - Navy Junior Recruit Officer Training Corps (NJROTC)
Resume_1100,"caregiver, cashier, credit, customer services, debit, English, home care, Neat, receiving, Self-Starter, Telephone, well organized",None mentioned,None explicitly mentioned,"Extensive customer services and caregiver knowledge, Great ability to multi-task, Volunteer work as a personal care worker and supportive home care provider"
Resume_2106," - Microsoft Office: Word, Excel, and PowerPoint - Data Track Time and Attendance Software - Electronic Data Interchange (EDI) Software - Press releases - Publicity - Spreadsheet - Training programs",None mentioned, - Data Track Time and Attendance Software - Electronic Data Interchange (EDI) Software - PowerPoint - Excel, - HR policy and organizational design - Job analysis - Employee management - Recruitment/selection process - Benefits/compensation - Contract negotiations - Performance management - Training/development - Strategic planning - Labor relations - Occupational health & safety - Pay equity and other related labor laws (locally and internationally) - Conflict resolution - International relations
Resume_1713, - Welding (MIG/TIG) - Automotive - Automotive CNC - CNC - CNC Programming - Shop Floor - Tooling - Amada - Engineer - Maintenance - Customer Service - Estimating - Manufacturing Engineer - Cost Estimating - Problem Solving - Plasma - Brakes - Stamping - Automotive Stamping - Continuous Improvement - Drafting - Engineering Support - Manufacturing Processes - Outside Sales - Press Brake - Proposals - Sales - Stamping Dies - Technical Support - Tool Room - Press Brakes - Laser - Motoman - Robotic - Robotic Welding - Strippit - Turret Press - Cost Analysis - Hand Tools - Inspections - Quality Control - Scheduling - Design for Manufacturing - Inspection - Flux Core - Load Calculations - Mechanical Engineer - Mechanical/Electrical Engineer - Product Support - Steel Design - Structural Steel - Structural Steel Design - Compressors - Inventory - Machining - Manufacturing Process - Packaging - Plating - Powder Coating - Project Management - Shear - Sorting - Total Project Management - Lasers - Air Conditioning - Assembly - AutoCAD - Autodesk - Buying/Procurement - Cabinets - Chassis - Circuit Board - Control Panel - Conveyors - Designer/Drafter - Electrical Schematics - Excel - Kaizen - Kanban - Lean Manufacturing - MS Excel - MS Outlook - MS Word - NCR - Outlook - Purchasing - Schematics - Stainless Steel - Stamping Press - Telecommunications - Training - Trusses - Word - Mechanical Engineering, - Die Setting Training - Lean Manufacturing Training - 5S/Kaizen Event/Kanban Training - A-B PLC Training, - AutoCAD 2012 - Digital Resources DB32 Punch/Plasma - Trumpf Suite Punch/Bend/Laser - Amada Punch/Plasma/Laser - Motoman MRC - Syman - Q&A - Made2Manage," - Structural steel design and pressure calculations - Wind and hurricane load calculations - Robotic welding - Detailed shop floor drawings - Electrical schematics and control panel drawings - Total project management from raw materials to packaging - Design for manufacturing - Subcontracting (machining, plating, silk screening, etc.) - Inventory management - Time study and cost analysis - Customer service and technical support"
Resume_440, - Microsoft Word - Microsoft Office - Microsoft Outlook - Microsoft Power Point - Microsoft Excel - Mostly Microsoft Excel and Microsoft Word - adding machines - Balance - billing - bonds - budget - Business Administration - calculators - cashier - clerical - Coach - excellent communication - Consultant - client - customer satisfaction - excellent customer service - Data Entry - decision making - discharge planning - email - filing - financial - funds - Human Resource - managing - exchange - mail - money - photography - Policies - problem resolution - processes - purchasing - quality assurance - receiving - maintain records - Research - Sales - SLA - sound - phone - transportation - treasury - type - typing - written,None mentioned, - Microsoft Excel - Microsoft Office applications - myuhc.com and other UnitedHealth Group websites - multiple databases - various internal systems and resources," - Handling irate and angry customers - Researching and analyzing data effectively - Excellent organizational and attention to detail skills - Proven interpersonal and customer service skills - Peer coaching and training new hires - Discharge planning - Coordinating transportation, budgets, equipment, and supplies - Ensuring compliance with regulations - Developing and maintaining community contacts and supervising volunteers - Coordinating move-ins/outs and welcome committee"
