File Name,Skills,Certifications,Tools,Additional Expertise
Resume_420," - Superb communication both verbal and written - Reliability and self-sufficiency - Strong work ethic - Organizational and problem-solving skills - Team player and multi-tasker - Career-minded, result-driven, and goal-oriented - Adaptable, positive, eager to contribute in any capacity - Microsoft Office - Fluent in French and English",None mentioned, - Microsoft Office," - Office administration and public speaking - Classroom management, behavior modification, and individualized support - Relationship-building and cultivating positive connections - Complex problem-solving and conflict resolution - Preparing reports, taking messages, and managing correspondence - Exceptional customer service and decision-making skills - Coordinating meetings, trips, and preparing responses on behalf of the company - Organizing, planning, and managing daily clerical needs - Handling correspondence and managing deliveries - Oral and written communication, team leadership, and relationship-building"
Resume_1309, - Journalism - Editorial - Leadership - New Media - Digital Media - Business Development - Audience Development - Strategic Planning - Product Management - Social Media - Online Journalism - Mobile - Advertising - Marketing - Digital Marketing - Media Strategy - Editorial Writing - Editing - Storytelling - Multimedia Storytelling - Content Strategy - Content Management - SEO - Organizational Skills - Consultant - Digital Analytics - Staff Development - Blogging - Media Relations - Art Director - Artificial intelligence - Business development - Consultant - Content - Clients - Editor - Innovation - Latin - Director - Managing - Marketing - Newspaper - Newspapers - Publications - Radio - Reporter - Research - Spanish - Television - Unique - Video - Websites, None mentioned," - Semantic intelligence - Web 3.0 - Artificial intelligence (applied to digital media) - Digital marketing (Incuentra.com, nlocal.es, nlocal.mx)"," - Specialized in new media (digital, social, audiovisual), business development, newsroom organization and media management - Extensive experience in the transformation of legacy media (especially newspapers and television) into digital and multimedia brands, and in the launching of new digital media - Winner of several awards and distinctions, including Society for News Design (SND) and José Martí Awards - Chosen as one of the most influential Spanish journalists on the Internet - Journalism professor at several universities - Frequent speaker at professional media events, conferences and workshops - Co-author of several books about journalism and digital media - Business and technology consultant in semantic intelligence, web 3.0 and artificial intelligence applied to digital media"
Resume_2023, - Advanced problem solving - Project planning and development - Finance and accounting - Employee relations - Team building - Negotiations expert - Strategic planning - Contract review and recommendations - Safety Oversight - Prime Contract Negotiations - Budgeting - Competitive Contracts Management - Marketing - Microsoft Office - Microsoft Project - Pro Core Project Management - Personnel Management - Procurement - Project Management - Systems Protocols and implementation - Quality Control, - LEED AP - ICC Class A License - ASHE (American Society of Health Engineers), - Incident and Issues Tracking (IIT) system - Electronic accounts payable system," - Over 30+ years of experience in commercial construction - Proactive, resourceful and hardworking with strong follow-through - Excellent problem-solving and time management abilities - Experienced in opening new operations, establishing protocols and procedures, and managing satellite locations - Skilled in project budgeting, change management, and client relationship management - Expertise in construction project management, from budgeting to closeout"
Resume_1360, - Delivery - Detail oriented - English - Inventory - Inventory Management - Logistics - Producing - Purchasing - Quality - Retail - Scheduling - Spanish - Work-flow, None mentioned, - Inventory management - Scheduling, - Knowledge of international cuisine - Experienced in preparing large volumes of food quickly and efficiently - Systematically controlling food quality and costs - Developing new menu items to enhance catering and retail food service revenue and productivity goals
Resume_2186," - KYC (Know Your Customer) - Anti Money Laundering - Legal documentation - Excellent organizational and time management skills - Strong interpersonal and communication skills - Microsoft Office (Excel, Word, PowerPoint, SharePoint, Project) - Employee relations (hiring, terminations, performance management, development) - Adobe products (Photoshop, Lightroom, Illustrator) - Spanish fluency (oral and written) - Credit - Critical thinking - Resolving customer concerns - Database management - Decision-making - Delivery - Documentation - Due diligence - Front Office - Funds - Investments - Legal - Management reporting - Problem solving - Process improvement - Quality Assurance - Real Estate - Sales - Self-starter"," - SEC Licenses Series 6 and 63 (Expired, willing to retake)"," - Microsoft Office (Excel, Word, PowerPoint, SharePoint, Project) - Adobe products (Photoshop, Lightroom, Illustrator) - KYC database - OFAC (Office of Foreign Assets Control) reviews"," - Experienced in managing teams in a fast-paced environment - Solid background in building strong and effective teams - Proficient in enhancing client experience, mitigating risk, and identifying areas of improvement - Experienced in conducting Quality Assurance reviews and approving due diligence reviews - Skilled in collaborating and managing cross-functional projects - Expertise in coordinating with various teams (Front Office, Credit, Compliance, AML compliance, global client onboarding) to understand client/deal structure and agree on requirements/responsibilities - Experienced in developing and implementing department policies and procedures to improve service and efficiency - Skilled in leveraging technology to increase efficiency and staff performance - Experienced in managing a portfolio of clients with deposits in excess of $80 billion - Expertise in reviewing complex Cash Collateral agreements and client documentation to ensure compliance - Skilled in escalating and resolving key issues and complex client concerns - Experienced in analyzing complex data for management reporting and decision-making - Skilled in fostering a proactive workplace environment to increase employee participation and performance"
Resume_602, - Leadership Development - Project Management - Budgeting - Employee Management - Operations Management - Business Management, - CPR - ACE - TAAF Sports Management School, - Multiple software applications - Supply chain management initiatives - Inventory control - Flexible manufacturing practices, - Research - Writing - Case management - Client relations - Inventory management - Risk management - Staff development - Marketing - Team building - Financial management
Resume_173, - AutoCAD R14 & 2000 - Aperture v. 5.0 - Microstation 7.1 - Adobe Illustrator - Photoshop 6.0 - Excel - Word - Broadband - Consultant - Cost analysis - Design and construction - HVAC - Interior design - Investments - Lighting - Marketing material - Mechanical - Meetings - Presentations - Progress - Proposals - Proposal - Quality - Renovation - Renovations - Retail - Supervision - Surveys,None mentioned, - AutoCAD R14 & 2000 - Aperture v. 5.0 - Microstation 7.1 - Adobe Illustrator - Photoshop 6.0 - Excel - Word - Broadband," - Project management - Construction administration - Client presentations - Researching building technologies and finishes - Maintaining design library and scheduling product presentations - Collaborating with domestic and international firms - Facilitating project initiation and consultant selection - Coordinating information flow between disciplines - Evaluating design consultant performance - Preparing marketing materials for clients, directors, and executives - Cost analysis - Historic restoration and preservation"
Resume_599," - Sales - Business development - Marketing - Market analysis - Business planning - Coaching - Client relations - Hospice/home health management - Durable medical equipment (DME) - Pharmaceuticals - Consultative sales - Active listening - Education - Communication (team member, presenter, trainer) - Medicare regulations for homecare and hospice",None explicitly mentioned, - Brochure development - Budget management - Contracts - Notes and follow-up - Weekly conference calls - Daily/weekly/monthly goal setting and reporting," - Rebranding and growing an agency from 8 to 130 patients - Ranked #1 Senior Provider Relations Manager nationally - Top performer in a 3-state region for 5 consecutive years - Developing and presenting CEU in-service trainings - Managing and coaching a team of 10 salespeople - Developing marketing tools and strategic sales plans - Establishing annual, monthly, weekly, and daily goals - Consistent follow-up with hand-written thank-you notes"
Resume_435, - Analytical Thinking - Knowledge of child development and the impact of abuse/trauma on children's functioning - Even Temperament - Excellent communication - Decision Making - Ethics - Interpersonal Relations - Interpersonal Awareness - Results Oriented - Computer literate - Valid Texas driver's license/insurance - Great communication and note-taking skills,None explicitly mentioned, - Conveyor belts and carousels - Fire and safety doors," - Knowledge of the challenges and difficulties that children living in stressful family situations face - Experience working with vulnerable children and families - Experience with the impact of abuse and neglect on children's development and functioning - Experience providing life skill training, mentoring, and support to students - Experience assisting students with planning for college/university attendance - Experience empowering students to develop skills in leadership, communication, decision-making, and healthy boundaries - Experience providing support to students with learning difficulties - Experience maintaining close links with parents/family and encouraging their involvement - Experience reporting incidents of child protection/neglect - Experience planning and organizing successful fundraisers - Experience liaising with the local community - Experience assessing, budgeting, and executing organizational goals - Experience developing Bible studies for students - Experience building relationships to generate financial support"
Resume_188," - Digital Illustration of art concepts for print, fabric and web applications using Adobe Creative Suite - Composition and layout for marketing collateral using InDesign - Manual sketching and mood boarding for look development of characters, live or digital, in accordance with director - 2D Pattern engineering and technical sketching for streetwear and theatrical costumes, using Gerber Computer Aided Design Systems - Photoshop, Illustrator, InDesign - Microsoft Office Suite - Windows & Mac environments - ZBrush, Cinema 4D, VUE"," - Certificate of Proficiency: Graphic Design / Animation from Studio Arts, Ltd. (2016) - Computer Aided Design, Lectra / Gerber Systems from Art Institute & LA Trade Tech - Digital Design, Patternmaking, Grading, and Marker-Making coursework from Art Institute & LA Trade Tech - Associate of Arts: Fashion Design from Brooks College"," - Gerber Systems (CAD) - Adobe Creative Suite (Photoshop, Illustrator, InDesign) - Microsoft Office Suite - ZBrush, Cinema 4D, VUE - Lectra / Gerber Systems (Computer Aided Design)", - Self-motivated professional - Resourceful researcher - Quick learner - Broad availability - Digital and Manual Illustration - Managed pattern and grading timelines for stage costumes and cast member uniforms - Quality assurance and determined Spec guidelines - Problem-solving for sizing and fit challenges - Technical Illustration for PLM documentation - Reduced garment manufacturing cost by over 60% and reduced production lead times by about 50% by creating and enforcing production efficiency standards and reducing waste - Maintained BOMs - Refreshed and customized theatrical costumes for each play - Assisted in prop-making and decoration - Maintained costume library - Assisted AFI students in developing character looks for their short film projects - Worked closely with director and head designer
Resume_756, - Accounts Payable - Art - Audio - Read Blueprints - Book - Budget - Cash Register - Closing - Cost control - Crisis Intervention - Customer Service - Delivery - HVAC - Inventory - Regulatory compliance - Managing - Materials - Mechanical - Organizing - Camera - Plumbing - POS - Problem solver - Procurement - Project Management - Receiving - Renovation - Renovations - Retail - Retail Sales - Safety - Scheduling - Staffing - Stress Management - Supervising - Troubleshooting - Utilities - Video - Wiring, - Electrical Assistant & HVAC-R Certificate - Trade Certificate: Electrical Assistant & HVAC/R Tech," - OTPS Receiving and Accounts Payable systems - FedEx, UPS and USPS shipping systems - 32 and 16 channel CCTV camera system - POS system"," - Engineering and physical plant responsibilities in healthcare - Project management for new constructions, renovations, alterations, mechanical, electrical, utilities, HVAC/R, plumbing, fire safety, communication and associated systems - Preventative routine maintenance of facilities including pond, waterfall, fountains, elevators, electrical, roof, landscaping, and HVAC - Selecting and managing staff and contractors"
Resume_755,"administrative functions, administrative support, art, automobiles, basic, changing bed linens, benefits, bookkeeping, charts, CPR, client, clients, data entry, emotional support, faxes, filing, first aid, general office duties, infection control, insurance, lamp, laundry, sorting mail, materials, serve meals, medical terminology, administering medication, mail, office, office administration, provide patients with help, progress, reception, routing, safety, scheduling, sorting, spreadsheet, telephone, phones, time management, travel arrangements",First Aid & CPR,"records management systems, excel spreadsheets, meeting planning, database entry, appointment scheduling","senior leadership support, insurance processing"
Resume_999,"cash management, communication skills, computer literate, customer service, upselling techniques, quick learner, merchandising, credit card processing, stocking, strategic sales knowledge, skilled problem solver, proficient in cash management, cash handling accuracy, banking and financial services background, organized, detail-oriented, excellent multi-tasker, display design, flexible schedule, proficient in MS Office",None mentioned,"vacuum cleaners, floor buffers, carpet machines","Positive reinforcement method, food preparation (baking, roasting, broiling, steaming), food handling and portion sizing, animal care (pre-surgery, diagnostic tests, euthanasia, exams), office management (distributing notices, screening visitors, call handling), accounting (invoice processing, purchase orders, expense reports, cash reconciliation)"
Resume_2328," - EIGRP, OSPF, BGP, Route Redistribution, ACLs, Policy based routing, NAT, PAT - Switching: HSRP, VRRP, GLBP VLANs, VTP, Link aggregation (LACP, PAGP), STP, PVST+ - Firewalls: Palo Alto, Cisco ASA, Check Point - Routers: Cisco Routers (7600, 7200, Catalyst 6500, Nexus 7000, ASR 12000, ASR 9000) - Switches: Cisco switches (Nexus 7000 series, 5000 Series, Catalyst 6500 series, 6800 series) - Security Concepts: App-ID, User-ID, Wildfire, GlobalProtect, URL filtering, Blue Coat Proxy, PKI, SSL decryption, IKE, IPSec, HIP checks, Site-to-Site VPNs - Load Balancers: F5 BIG-IP (LTM/GTM), Citrix NetScaler - Wireless Networking: Cisco Meraki, Aruba, Clear-pass, Cisco WLAN, Wireless Aps, 802.1X a/b/g/n/ac - Software/Applications: Panorama, Cisco IOS, NX-OS, Smart Dash Board, VMware - Tools: SPLUNK, Solar Winds, SevOne, Wireshark, MS Visio, Lucid Chart, BMC Remedy - Routing: EIGRP, OSPF, BGP, Route Redistribution, ACLs, Policy based routing, NAT, PAT - Switching: HSRP, VRRP, GLBP VLANs, VTP, Link aggregation (LACP, PAGP), STP, PVST+ - Risk management processes and analysis", - CCNA - CCNP - Palo Alto ACE," - Palo Alto Firewalls - Cisco ASA Firewalls - Check Point Firewalls - Load Balancers: F5 BIG-IP, Citrix NetScaler - Wireless networking: Cisco Meraki, Aruba, Clear-pass, Cisco WLAN - VMware - Data center management - SPLUNK, Solar Winds, SevOne, Wireshark, MS Visio, Lucid Chart, BMC Remedy", - Designing manageable networks - Threat prevention and management - Troubleshooting network performance issues - Documentation - Risk management processes and analysis
Resume_1341, - analytical skills - Agency - Attention to detail - call center - Call Center - Caregiver - Case Management - cash register - Interpersonal communication - Oral communication - CA - CPR - credit - client - clients - customer services - Customer Service - customer care - database management - doors - equipment operation - fax - hoists - HOME CARE - IVR - Listening - notes - Machinist - maintenance schedule - materials - mechanical - MS Excel - Excel - Outlook - word - Microsoft Word - Navy - Naval - Assist patients - personnel - copy machine - Problem Resolution - Problem solving skills - quality - Quality assurance - quick - real time - repairing - Sales - San - schematics - self-motivated - scripts - Telecommunications - telephone - phone - toileting - tops - Troubleshooting - Verbal Communication Skills - record vital signs - written, - OC Certification - Baton Employment - Close Range Subject Control (CRSC) Techniques - Certificate Of Contamination, - Microsoft Word - Microsoft Excel - Microsoft Outlook - Cash register - Fax machine - Copy machine - Database management applications, - Machinist - Non Lethal Weapons training - Mechanical Engineering - Psychology - Business Administration
Resume_1073,"OSHA inspections, exceptional interpersonal skills, new hire orientation, compensation/payroll, recruiting, hiring and retention, training and development, regulatory compliance, personnel records maintenance, exceptional time management skills, adaptable, administrative, cash registers, clerical, credit, excellent customer service, inventory, exchange, money, nursing, organizational skills, reporting, sales, supervision, telephones",Georgia Medical Certificate,"cash registers, inventory management, patient documentation, medical office procedures","implementation of new tracking system, ensuring charting accuracy, training staff nurses, patient care and support, staff management and development, risk management and service improvement, infection control, budget creation and cost reduction"
Resume_2201," - SAS programming - R programming - SSPS programming - Excellent research skills - Microsoft Word, Excel, PowerPoint - Excellent quantitative skills - Team leadership - Organizational planning - Leadership/communication skills - Customer-oriented", - SAS advanced license, - R - SAS - SSPS - Linear model - Lasso regression - Multivariate adaptive regression splines - K-mean clustering - Hierarchical clustering - Boosting - Random Forest - Ridge regression - Lasso regression - Neural networks - CART - SVM - GARCH model - ARMAR model, - Experiment design - Sampling techniques - Documents management - Statistical inference - Time series analysis - Survival analysis - Experimental design - Practical statistical models - Data analysis
Resume_463, - 10 key - Adding machine - Approach - Agency - Banking - Basic - Bonds - Case management - Cash handling - Clerical - Conflict resolution - Copying - Counseling - Crisis intervention - Client - Clients - Customer service - Data entry - Driving - Trains employees - Faxing - Filing - Financial - Forms - Fundraising - Law enforcement - Legal - Letters - Director - Meetings - Access - Microsoft Excel - Money - Office - PowerPoint - Microsoft Word - Works - Multi-tasking - Organizing - Personnel - Police - Policies - Presentations - Public relations - Receiving - Record keeping - Recruiting - Reporting - Researching - Safety - Scanning - Secretarial - Statistics - Supervisor - Supervisory - Supervising - Taking messages - Phone - Typing 65 wpm - Warrants,None mentioned," - Microsoft Office Suite (Excel, Word, PowerPoint)"," - Crisis intervention and resolution - Complex problem solving skills - Valid Texas driver's license - Reliable transportation - Strong decision maker - Fundraising background - Client engagement - Compassionate - Dedicated patient advocate - Self-starter - Event planning and coordination - Coursework in Business, Communications, Advertising, Accounting, Human Computer Interaction, and Technical/Professional Writing"
Resume_2301," - Microsoft Office proficiency (PowerPoint, Publisher, Word, Excel) - Excel spreadsheets - Meticulous attention to detail - Travel administration - Strong problem solver - Customer service-oriented - Meeting planning - Desktop publishing software (Photoshop)", None mentioned, - SAP - Access databases - Project Tracker database - Tire Book and In-Stock Report - Tire Order Pad - Retail's intranet site (Pit Row)," - Graphic design and creation of promotional materials - Website management and e-marketing - Financial reporting and accounting - HR generalist support (succession planning, interviews, onboarding) - Intern and development program management - Database maintenance and analytics - Global communication and meeting coordination"
Resume_43, - Administrative Support - Anti-Virus - Billing - Budget - Oral communication - Conferences - Clients - Customer satisfaction - Databases - Documentation - Finance - Help Desk - Inside Sales - Marketing - Meetings - Access database - Excel spreadsheets - PowerPoint - Microsoft Word - Office Manager - Organizing - Pricing - Printers - Problem solving - Processes - Coding - Purchasing - Quality - Recording - Recruitment - Sales - Scheduling - Spreadsheets - Surveys - Travel arrangements - Troubleshooting - Websites - Written communication,None mentioned," - Quickbooks - Tigerpaw - Microsoft Office Suite (Word, Excel, Access) - PowerPoint - Select Surveys", - Human resources understanding - Scheduling proficiency - Market research proficiency - Report generation - Critical thinking - Eye for detail - Self-directed nature - Analytical problem solving - Contracts - Social media and networks - Exceptional telephone etiquette - Patient and diligent
Resume_111," - Critical Thinker - Using logic and reasoning to identify the strengths and weaknesses of alternative solutions, conclusions or approaches to problems - Time Management & Communication - Managing one's time, as well as team's, to adhere to Drop Dead Dates - Adaptability - Being flexible to change as it comes and resolving in a timely manner - Social Perceptiveness - Working with team and taking leadership role to maintain brand direction - Attention to Detail - Thorough and complete work in all related processes to end product - Innovation - Demonstrated creative ability to design within business budgets, while following consumers' needs/trends - Strong creative design skills - Merchandising - Creating Line sheets/Look-books - Demographic studies - Well versed in Adobe softwares; Illustrator & PS - Technical Drawings - MAC and PC versatility - Hand-Pattern work", - Certified OZ PRINCIPLE Leader 2014 - Present," - PLM, WebPDM, & GalleryNedgraphics - Oracle E-Business Suite"," - Trend and emerging brand awareness - Spec measurements - Featured in WGSN 2015 Retail Analysis - Asia, Mex., & Euro Dev./Prod. Vendor Communications"
Resume_56, - ADA - Approach - Arbitration - Auditing - Business strategy - Case management - Contract negotiations - Crisis management - Finance - Functional - HRIS - Human Resource - Human resources - HR - Information systems - ISO - Leadership - Material Science - Money - Negotiating - Negotiation - Negotiations - Network - Organizing - Organizational - Payroll - Performance management - Personnel - Policies - Problem solving - Quality - Recruiting - Recruiter - Safety - Staffing - Structured - Supervisor - Technical training, - ISO 22000 quality auditor - ISO 14001 Environmental auditor, - ABRA (HRIS)," - Experienced in union and non-union manufacturing, sales, and headquarters environments - Established North American region safety operations network across the US and Canada - Behavior-based safety methods - 12-hour 24/7 shift organization - Succession planning and recruiting - Kaizen, quality advantage training, quality of leadership, and money stream training - Case management and return-to-work programs - Structured problem-solving approach - Performance management process - Cell-based and skill-based pay language integration - ADA and FMLA policy implementation - Workforce development training grant acquisition"
